{"allowed_actions":["READ_FROZEN_REPOSITORY_CONTRACTS","VERIFY_ALL_NON_NULL_INPUT_HASHES","READ_EXACT_SEALED_PRE2025_H1_CORPUS","VALIDATE_H1_AND_DAILY_CLOCK_INTEGRITY","RUN_FROZEN_NR7_DIRECT_ECONOMIC_RUNNER_TWICE","COMPARE_BYTE_IDENTICAL_RESULTS","EVALUATE_FROZEN_GATE_MATRIX","RETURN_LOCAL_RESEARCH_RESULT"],"authorization":"RESEARCH_ONLY_NOT_SHADOW_PAPER_OR_LIVE","canonical_research_status":"SERVER_CANONICAL_WAITING_QUEUE_IDLE_FUNNEL_READY_ZERO_ACTIVE_ZERO_OOS_2026_08_24T11_57_48Z","execution_mode":"READ_ONLY","expected_outputs":["EXACT_PACKAGE_PREFLIGHT_VALIDATION","SEALED_H1_SOURCE_INTEGRITY","NR7_DECISION_FEATURE_ACCOUNTING","DESIGN_AND_VALIDATION_LEDGER_MATRIX","ANNUAL_BREADTH_AND_CONCENTRATION","FROZEN_GATE_MATRIX","ONE_TERMINAL_FAMILY_DISPOSITION","MISSING_PROOF_REGISTER","OPPORTUNITY_COST_AND_NEXT_ACTION"],"forbidden_actions":["CANONICAL_STATE_WRITE","SERVER_RESEARCH_MCP_WRITE","SECOND_TIMER_OR_WRITER","TRADING_DB_ORDERS_FUNDS_SHADOW_PAPER_LIVE","OOS_OPEN_OR_GATE_RELAXATION","EXTERNAL_BACKFILL_OR_IMPORT","PAID_API_OR_API_KEY","PRODUCTION_OR_DATABASE_MUTATION","UNLISTED_REPOSITORY_OR_RESEARCH_STATE_WRITE","POST2024_OR_FORWARD_EVIDENCE_ACCESS","CURRENT_SERVER_STATUS_REFRESH_OR_NETWORK_ACCESS","RUNNER_SOURCE_OR_ACCOUNTING_CHANGE","RANGE_FORMULA_LOOKBACK_TIE_BREAKOUT_HOLD_COST_WINDOW_OR_GATE_TUNING","REJECTION_ONLY_NEIGHBOR_SUBSTITUTION","GIT_STAGE_COMMIT_PUSH_OR_RESET"],"inputs":[{"kind":"REPOSITORY_PATH","locator":"AGENTS.md","sha256":"acae1925d4f2247dc8ffbd60efd7d9bd86844ef6ce9bf8f3b5bdf57906177e50"},{"kind":"REPOSITORY_PATH","locator":".agents/skills/autonomous-trading-research/SKILL.md","sha256":"70a277dea310699d7a93a3c6bc5897c989ca53b8927022f344c82df87d3fc44d"},{"kind":"REPOSITORY_PATH","locator":"docs/autonomous-research-charter.md","sha256":"4324ca6dd4ac3cd1a8942e178f1934e8147d97de96a4289f306f8355963240f7"},{"kind":"REPOSITORY_PATH","locator":"docs/local-codex-research-node-v1.md","sha256":"3091b438fd9145a099f6f912c4009beacdac247f71d8d34cc3edc8355a59c1e5"},{"kind":"REPOSITORY_PATH","locator":"research_pipeline/policy.v3.json","sha256":"a82ccff13c13765d1e94a29698a43b35b847ed19190965590fa72e9a102981f6"},{"kind":"REPOSITORY_PATH","locator":"research_pipeline/hypothesis.schema.json","sha256":"db97030842f24bc2b0eda7a621861f807fc6598a1e5c600f9363fd12f060a8c1"},{"kind":"REPOSITORY_PATH","locator":"research_pipeline/local-research-result.schema.json","sha256":"baeb8d3c61dd685234ac24d1f5211199af47398702f076a347f7a4e807f97659"},{"kind":"REPOSITORY_PATH","locator":"research_pipeline/local-research-strategy-path.v1.schema.json","sha256":"a1902ccf14b502edf14d4a4c1e261fa9f26b489b8d00986b8f8b22763cdf9751"},{"kind":"REPOSITORY_PATH","locator":"research_pipeline/local-direct-screen-package.v1.schema.json","sha256":"3542a95c031767154c4b26775e7d7a0e9a9f6a95f21855c25dba4deb5472e3d4"},{"kind":"REPOSITORY_PATH","locator":"research_pipeline/local_direct_screen_package.py","sha256":"559874c55cd011b600154d83219d14feeee2554168bac9e605c80218c033049a"},{"kind":"REPOSITORY_PATH","locator":"research_pipeline/examples/local-direct-screen-package.btc-daily-nr7-volatility-contraction-breakout-v1.json","sha256":"3a30ec6ebc776885551fa0f25a87e6dbebd98ec540cc0daeb283a8f716f268ff"},{"kind":"REPOSITORY_PATH","locator":"research_pipeline/examples/btc-daily-nr7-volatility-contraction-breakout-primary-prior.v1.json","sha256":"ea9b7b2f7d21877ab998ffb9cdfe9b3daa2f6eab7cbea8c9e380eadbcb15f4d7"},{"kind":"REPOSITORY_PATH","locator":"research_pipeline/examples/btc-daily-nr7-volatility-contraction-breakout-v1.hypothesis.json","sha256":"3a823b16afabd1ec7a5a3043c0b58adab61be9849d1d44f8d980bc56dc9c8c8a"},{"kind":"REPOSITORY_PATH","locator":"research_pipeline/examples/btc-daily-nr7-volatility-contraction-breakout-historical.v1.manifest.json","sha256":"fcc9121b98f705c6e502cc4bfac1780efa8934b526d171ef09d510969980bfe0"},{"kind":"REPOSITORY_PATH","locator":"research/btc_daily_nr7_volatility_contraction_breakout_historical.py","sha256":"0403de054c3e5b4c55d91f5f9c6d552fb57c3a806298a5617ed9bd11b019ced4"},{"kind":"REPOSITORY_PATH","locator":"research/btc_dra_reversal_confirmed_exit_v2c.py","sha256":"7b17f1acc591b571ed238b5d8141d0bc2b2ebd4bde860273db23c17398e05e37"},{"kind":"REPOSITORY_PATH","locator":"research_pipeline/examples/btc-donchian-20d-10d-standalone-historical.v1.decision.json","sha256":"9032a111eb8288aa45d016f044b2823c06e003d6f9f0f06be00202d150d2e67c"},{"kind":"REPOSITORY_PATH","locator":"research_pipeline/pre-candidate-pool.v1.json","sha256":"2174bbc53b364c2f1dcd63b9ed94732eac69c5685527f196a3831097c8ef6f76"},{"kind":"SEALED_ARTIFACT","locator":".research-state/java-parity/selection-2019-2024.tsv","sha256":"e436a5a2b093365886464dd3e471cc5cd55c54bd2c06ceaa898ac218c45436dd"},{"kind":"TASK_MESSAGE","locator":"Decision feature: strict NR7 means the latest complete UTC day's normalized true range is strictly smaller than each of the preceding six complete days. NR5 and NR10 are rejection-only neighbors. Only the first complete H1 close on the immediately following UTC day strictly above the setup-day high may queue entry at the next H1 open.","sha256":null},{"kind":"TASK_MESSAGE","locator":"Frozen policy and accounting: invest full capital in unlevered BTC or zero-yield cash, hold exactly 168 hours, deny same-open reentry and ignore overlapping signals. The exact unconditioned prior-complete-day-high breakout with the same entry and holding policy is the parent; full-capital buy-and-hold is the opportunity comparator. Design is 2020-2022, Validation is 2023-2024 and annual fair-reset folds are 2020-2024. Normal costs are 10 bps fee plus 5 bps adverse slippage per side; stress costs are 20 plus 10 bps.","sha256":null},{"kind":"TASK_MESSAGE","locator":"Frozen all-pass gates require positive parent and candidate economics, sufficient setup and completed-trade support, at least 60 percent parent return, drawdown at most 75 percent of parent and 65 percent of buy-and-hold, Calmar at least parent and 75 percent of buy-and-hold, at least 20 percent buy-and-hold upside, stable NR5 and NR10 Validation neighbors, annual breadth, top-year and top-trade contribution at most 60 percent, P90 and terminal holding at most 168 hours and terminal liquidation cost at most 1pp. Any failure closes the family without tuning.","sha256":null}],"issued_at":"2026-08-24T12:24:00Z","limits":{"max_candidate_variants":0,"max_files_changed":0,"network_access":"NONE","timeout_seconds":3600},"manager_thread_id":"019fca63-4f8f-71e3-9d88-297bca468eb9","objective":"Evaluate exactly one frozen BTC daily NR7 volatility-contraction-conditioned breakout on the sealed pre-2025 H1 corpus. Compare strict NR7 with rejection-only NR5 and NR10 against the identical unconditioned prior-day-high breakout and full-capital buy-and-hold under identical normal and stress costs. Freeze a historical candidate only if every Design, Validation, annual breadth, concentration, holding, terminal and neighbor gate passes; otherwise permanently close the exact family without tuning. This is historical development evidence, not OOS or Trading authorization.","schema_version":"1","state_authority":"SERVER_CANONICAL","stop_conditions":["Before outcome access, validate exact task, dispatch, intent and strategy path; rehash all non-null inputs and require clean HEAD equal to origin after the package commit. Any failure is BTC_DAILY_NR7_VOLATILITY_CONTRACTION_BREAKOUT_EVIDENCE_INSUFFICIENT.","Require the sealed H1 corpus SHA-256 e436a5a2b093365886464dd3e471cc5cd55c54bd2c06ceaa898ac218c45436dd with 52608 contiguous finite rows and 2192 complete UTC days. Do not repair a failure.","Use only strict normalized-true-range NR7 primary and strict NR5 and NR10 rejection-only neighbors, immediately-next-day prior-high close breakout, next-H1-open execution, fixed 168-hour hold and frozen costs, windows and gates.","Run the frozen runner twice to new create-only outputs and require byte-identical SHA-256 results.","Return the positive disposition only if every frozen gate passes; otherwise valid economics returns BTC_DAILY_NR7_VOLATILITY_CONTRACTION_BREAKOUT_FAMILY_CLOSE without tuning.","A positive result remains historical and REPORTED_NOT_ACTIVATED. It authorizes at most one independent sealed OOS and no Trading action."],"task_id":"local-node-btc-daily-nr7-volatility-contraction-breakout-v1","task_type":"EVIDENCE_DIAGNOSTIC","timer_authority":"CODEX_CLOUD_OPS_ONLY"}
