{"allowed_actions":["READ_FROZEN_REPOSITORY_CONTRACTS","VERIFY_ALL_NON_NULL_INPUT_HASHES","READ_EXACT_SEALED_PRE2025_FUNDING_CORPUS","VALIDATE_HOURLY_AND_FUNDING_LATTICES","RUN_FROZEN_FUNDING_CARRY_RUNNER_TWICE","COMPARE_BYTE_IDENTICAL_RESULTS","EVALUATE_FROZEN_GATE_MATRIX","RETURN_LOCAL_RESEARCH_RESULT"],"authorization":"RESEARCH_ONLY_NOT_SHADOW_PAPER_OR_LIVE","canonical_research_status":"SERVER_CANONICAL_WAITING_QUEUE_IDLE_FUNNEL_READY_ZERO_ACTIVE_ZERO_OOS_LAST_VERIFIED_2026_08_22T09_35_18Z","execution_mode":"READ_ONLY","expected_outputs":["EXACT_PACKAGE_PREFLIGHT_VALIDATION","SEALED_CORPUS_INTEGRITY","DESIGN_AND_VALIDATION_LEDGER_MATRIX","ANNUAL_AND_QUARTER_BREADTH","DRAWDOWN_MARGIN_AND_BASIS_PATH","FROZEN_GATE_MATRIX","ONE_TERMINAL_FAMILY_DISPOSITION","MISSING_PROOF_REGISTER","OPPORTUNITY_COST_AND_NEXT_ACTION"],"forbidden_actions":["CANONICAL_STATE_WRITE","SERVER_RESEARCH_MCP_WRITE","SECOND_TIMER_OR_WRITER","TRADING_DB_ORDERS_FUNDS_SHADOW_PAPER_LIVE","OOS_OPEN_OR_GATE_RELAXATION","EXTERNAL_BACKFILL_OR_IMPORT","PAID_API_OR_API_KEY","PRODUCTION_OR_DATABASE_MUTATION","UNLISTED_REPOSITORY_OR_RESEARCH_STATE_WRITE","POST2024_OR_FORWARD_EVIDENCE_ACCESS","CURRENT_SERVER_STATUS_REFRESH_OR_NETWORK_ACCESS","RUNNER_SOURCE_OR_ACCOUNTING_CHANGE","ALLOCATION_LEVERAGE_REBALANCE_CLOCK_CONTRACT_VENUE_OR_COST_TUNING","GIT_STAGE_COMMIT_PUSH_OR_RESET"],"inputs":[{"kind":"REPOSITORY_PATH","locator":"AGENTS.md","sha256":"acae1925d4f2247dc8ffbd60efd7d9bd86844ef6ce9bf8f3b5bdf57906177e50"},{"kind":"REPOSITORY_PATH","locator":".agents/skills/autonomous-trading-research/SKILL.md","sha256":"70a277dea310699d7a93a3c6bc5897c989ca53b8927022f344c82df87d3fc44d"},{"kind":"REPOSITORY_PATH","locator":"docs/autonomous-research-charter.md","sha256":"4324ca6dd4ac3cd1a8942e178f1934e8147d97de96a4289f306f8355963240f7"},{"kind":"REPOSITORY_PATH","locator":"docs/local-codex-research-node-v1.md","sha256":"3091b438fd9145a099f6f912c4009beacdac247f71d8d34cc3edc8355a59c1e5"},{"kind":"REPOSITORY_PATH","locator":"research_pipeline/policy.v3.json","sha256":"a82ccff13c13765d1e94a29698a43b35b847ed19190965590fa72e9a102981f6"},{"kind":"REPOSITORY_PATH","locator":"research_pipeline/local-research-result.schema.json","sha256":"baeb8d3c61dd685234ac24d1f5211199af47398702f076a347f7a4e807f97659"},{"kind":"REPOSITORY_PATH","locator":"research_pipeline/local-research-strategy-path.v1.schema.json","sha256":"a1902ccf14b502edf14d4a4c1e261fa9f26b489b8d00986b8f8b22763cdf9751"},{"kind":"REPOSITORY_PATH","locator":"research_pipeline/local-direct-screen-package.v1.schema.json","sha256":"3542a95c031767154c4b26775e7d7a0e9a9f6a95f21855c25dba4deb5472e3d4"},{"kind":"REPOSITORY_PATH","locator":"research_pipeline/local_direct_screen_package.py","sha256":"559874c55cd011b600154d83219d14feeee2554168bac9e605c80218c033049a"},{"kind":"REPOSITORY_PATH","locator":"research_pipeline/examples/local-direct-screen-package.btc-binance-usdm-funding-carry-v3.json","sha256":"87d3db032d493d4e44da1adc8dfea6b5f52f77c62d0aad6a2cafc59eaa28d5a6"},{"kind":"REPOSITORY_PATH","locator":"research_pipeline/examples/btc-binance-usdm-delta-neutral-funding-carry-primary-prior.v1.json","sha256":"40adff8c29f5e5da386a00363b607d5af6185bab0b4de6792d3d02846b2620ed"},{"kind":"REPOSITORY_PATH","locator":"research_pipeline/examples/binance-usdm-derivatives-archive-source-capability.v1.json","sha256":"166deda2f8d86a259e93e26162fa520344e2077009919a780cd64dc08f0ff2e4"},{"kind":"REPOSITORY_PATH","locator":"research_pipeline/examples/btc-binance-usdm-delta-neutral-funding-carry-historical.v1.source-ledger-spec.json","sha256":"41745a4c173714534f4bdeb63ca594a0250c056143b356cc22b2344212dfad79"},{"kind":"REPOSITORY_PATH","locator":"research_pipeline/examples/btc-binance-usdm-delta-neutral-funding-carry-historical.v3.source-integrity-closure.json","sha256":"35e048656e72dd1e273f67fa8149c25a43e62f62e25202132fa4f96ebb9f04a0"},{"kind":"REPOSITORY_PATH","locator":"research_pipeline/examples/btc-binance-usdm-delta-neutral-funding-carry-v3.hypothesis.json","sha256":"d26714f9ea11b232f109864b45216b1bfb23d3b9ee860c39fe367f81375daaf1"},{"kind":"REPOSITORY_PATH","locator":"research_pipeline/examples/btc-binance-usdm-delta-neutral-funding-carry-historical.v3.manifest.json","sha256":"80875ee81027a9c6794319a0acf3648d4ce94c4cf5307e923834f72c20a1fcb6"},{"kind":"REPOSITORY_PATH","locator":"research/btc_binance_usdm_delta_neutral_funding_carry_historical.py","sha256":"2821b762b9d685a1a70ddbb28066dea75ce255d7150143a35a7838370dfc499e"},{"kind":"SEALED_ARTIFACT","locator":".research-state/experiments/btc-binance-usdm-delta-neutral-funding-carry-historical-v3/inputs/corpus.v3.json","sha256":"1da0ab1082f251dcb631b2b89e66d12a0c4ae831db4d79d02c5dfeb8f5809b74"},{"kind":"SEALED_ARTIFACT","locator":".research-state/experiments/btc-binance-usdm-delta-neutral-funding-carry-historical-v3/inputs/btcusdt-spot-perp-mark-funding-2020-2024.v3.csv.gz","sha256":"0bc3fae0fd1de2ce546592971ae9867c3c7cc4328d2b9733b43c357131a0e24b"},{"kind":"TASK_MESSAGE","locator":"Frozen economic policy: start each fair-reset window with 10,000 USDT; allocate 25 percent to long BTC spot and 75 percent to Binance USD-M futures collateral; short the perpetual in exactly the same BTC quantity; reset at quarter-start 01:00 UTC after the 00:00 funding event; liquidate fully at the window boundary. No leverage, threshold, venue, contract, allocation or clock scan is allowed.","sha256":null},{"kind":"TASK_MESSAGE","locator":"Funding accounting and costs: a short receives quantity times official mark-price open times signed funding rate. NORMAL charges 10 bps fee plus 5 bps adverse slippage on each spot and perpetual side; STRESS charges 20 plus 10 bps. Conservative maintenance margin is 10 percent and the minimum required buffer is 2.0. The comparator is zero-yield cash with identical initial equity and window.","sha256":null},{"kind":"TASK_MESSAGE","locator":"Frozen all-pass decision: Design 2020-2022, Validation 2023-2024, five annual fair resets and twenty quarterly fair resets must pass the preregistered return, funding-minus-cost, drawdown, Calmar, margin, liquidation, breadth, concentration, coverage and terminal-inventory gates. A valid failure permanently closes this exact family without tuning; a pass is historical only and cannot open OOS or activate Trading.","sha256":null}],"issued_at":"2026-08-22T12:00:00Z","limits":{"max_candidate_variants":0,"max_files_changed":0,"network_access":"NONE","timeout_seconds":3600},"manager_thread_id":"019fca63-4f8f-71e3-9d88-297bca468eb9","objective":"Evaluate exactly one preregistered quarterly-reset Binance BTCUSDT delta-neutral funding-carry policy on the sealed checksum-verified 2020-2024 corpus. Run the frozen direct economic ledger twice under normal and stress two-leg costs; require byte-identical results and every Design, Validation, annual, quarter, drawdown, margin, concentration and terminal-inventory gate. Freeze a historical candidate only if all gates pass; otherwise permanently close the exact 25-percent-spot and 75-percent-collateral equal-quantity family without tuning. This is historical development evidence, not OOS or Trading authorization.","schema_version":"1","state_authority":"SERVER_CANONICAL","stop_conditions":["Before outcome access, validate the exact task, dispatch, intent and strategy path; re-hash every non-null input and require a clean branch whose HEAD equals origin. Any mismatch returns BTC_BINANCE_USDM_FUNDING_CARRY_EVIDENCE_INSUFFICIENT.","Read only the listed files, task messages and exact two sealed corpus files. Do not inspect another research artifact, current server state, post-2024 observation, forward outcome or OOS.","Require bundle SHA-256 1da0ab1082f251dcb631b2b89e66d12a0c4ae831db4d79d02c5dfeb8f5809b74, gzip SHA-256 0bc3fae0fd1de2ce546592971ae9867c3c7cc4328d2b9733b43c357131a0e24b, exactly 43,848 contiguous hourly rows and 5,481 unique eight-hour funding events. Do not repair a failure.","Require the committed direct runner and every support file at frozen task hashes. Run without editing, monkey-patching, wrapping or changing economics.","Use exactly one 25/75 equal-quantity quarterly-reset policy and the two frozen cost scenarios. Do not run another variant.","Return BTC_BINANCE_USDM_FUNDING_CARRY_HISTORICAL_CANDIDATE_FROZEN_NOT_ACTIVATED only if every frozen gate passes; valid paired evidence otherwise returns BTC_BINANCE_USDM_FUNDING_CARRY_FAMILY_CLOSE without tuning.","Return BTC_BINANCE_USDM_FUNDING_CARRY_EVIDENCE_INSUFFICIENT for any input, data, temporal, arithmetic, accounting or required-field failure. Do not partially classify or request permission."],"task_id":"local-node-btc-binance-usdm-funding-carry-v3","task_type":"EVIDENCE_DIAGNOSTIC","timer_authority":"CODEX_CLOUD_OPS_ONLY"}
