{
  "schema_version": "1",
  "task_id": "local-node-microstructure-economic-veto-runner-acceptance-recovery-v1",
  "issued_at": "2026-08-11T04:26:00Z",
  "manager_thread_id": "019fca63-4f8f-71e3-9d88-297bca468eb9",
  "task_type": "CAPABILITY_READINESS",
  "execution_mode": "READ_ONLY",
  "objective": "Recover the formal, non-counting acceptance trace for the already implemented OKX microstructure discovery economic veto runner without modifying the frozen original lifecycle or any implementation byte. Independently verify the exact Git parent/child lineage, current artifact hashes, original task/dispatch/result closure, Manager validation receipt, offline compilation, the exact 127-test affected suite, frozen m+2/m+62 and economic-gate semantics, fixed-root isolation, create-once publication and all safety boundaries. Return one fail-closed acceptance disposition. Do not access real Local roots, R2 evidence or outcomes, create a strategy or candidate, open OOS, change canonical state, or touch Trading.",
  "canonical_research_status": "R2_ECONOMIC_VETO_RUNNER_ACCEPTANCE_RECOVERY_ONLY",
  "authorization": "RESEARCH_ONLY_NOT_SHADOW_PAPER_OR_LIVE",
  "state_authority": "SERVER_CANONICAL",
  "timer_authority": "CODEX_CLOUD_OPS_ONLY",
  "inputs": [
    {"kind":"REPOSITORY_PATH","locator":"research_pipeline/policy.v3.json","sha256":"a82ccff13c13765d1e94a29698a43b35b847ed19190965590fa72e9a102981f6"},
    {"kind":"REPOSITORY_PATH","locator":"research_pipeline/local_node.py","sha256":"b824b431a92cbcab5609b04e80f446c17518d712192aee0e23cd3b37ea2512ed"},
    {"kind":"REPOSITORY_PATH","locator":"research_pipeline/local_dispatch.py","sha256":"f1fbe40f63a38f4c362c94ef1c8b4dd6a15f347a2e82f8f432a7f6f47064c64b"},
    {"kind":"REPOSITORY_PATH","locator":"research_pipeline/local_weekly_output_classification.py","sha256":"970c9fddef6392afef18a075fd4a9f7e44ee022f4d8245d251e1d200f80d442b"},
    {"kind":"REPOSITORY_PATH","locator":"research_pipeline/local-research-result.schema.json","sha256":"baeb8d3c61dd685234ac24d1f5211199af47398702f076a347f7a4e807f97659"},
    {"kind":"REPOSITORY_PATH","locator":"research_pipeline/examples/manager-validation-receipt.microstructure-discovery-economic-veto-runner.v1.json","sha256":"337008f683fc2ee71dd9be786d76190da6543b258536f3a879f7929ed0d3948c"},
    {"kind":"REPOSITORY_PATH","locator":"research_pipeline/examples/local-research-task.microstructure-discovery-economic-veto-runner.v1.json","sha256":"3be0e4e58fdf4345b9f2e9263f032a26af80638185dd59d35569e643dfcfac05"},
    {"kind":"REPOSITORY_PATH","locator":"research_pipeline/examples/local-research-dispatch.microstructure-discovery-economic-veto-runner.v1.json","sha256":"2f9a8556319389cf4d3832024b29541f285e8b99e0e0933a26db40853a2f7b74"},
    {"kind":"REPOSITORY_PATH","locator":"research_pipeline/examples/local-weekly-output-classification.intent.microstructure-discovery-economic-veto-runner.v1.json","sha256":"673e4144643d3d3a9009382b18ce94ee4fa07415e47762cfa3a6b6e57934151a"},
    {"kind":"REPOSITORY_PATH","locator":"research_pipeline/examples/local-research-result.microstructure-discovery-economic-veto-runner.v1.json","sha256":"e8c48b70615cdbfab5d7df8721f07e67c151329b3adabf5de22ad40c99eff4f1"},
    {"kind":"REPOSITORY_PATH","locator":"research_pipeline/microstructure_discovery_economic_veto.py","sha256":"e89b4d5b53565d43372422ca43b44a87907cffaa6f349e96c196bb299adbdfa9"},
    {"kind":"REPOSITORY_PATH","locator":"research_pipeline/microstructure_discovery_economic_veto_runner.py","sha256":"f43ad5cd1c418f28b1572dad73028b9eee1cfca6d95c8b4850f2fd4185418271"},
    {"kind":"REPOSITORY_PATH","locator":"research_pipeline/tests/test_microstructure_discovery_economic_veto_runner.py","sha256":"7e596a7f50775fc4a246edd05bac8a8bc2570c86140a22429884ab87c4904d15"},
    {"kind":"REPOSITORY_PATH","locator":"docs/okx-microstructure-discovery-economic-veto-runner-v1.md","sha256":"e1aa77dfc4d4531907255285249427e6b328e5a180f61957248706e4ee99f661"},
    {"kind":"REPOSITORY_PATH","locator":"research_pipeline/microstructure-discovery-economic-veto-result.v1.schema.json","sha256":"19b914871f39b2703229e716332021f8be7932845cfa5de2f2ff0c52886b2771"},
    {"kind":"TASK_MESSAGE","locator":"Git proof boundary: implementation commit b400d49b73018376c71a8bc923f42ff23f503566 must have sole parent 8ffc8ac57a79037cef1adbb9afa8f652538221db and add exactly the four implementation paths plus the original Local result. The invalid acceptance add/delete history must not be rewritten. The original intent digest mismatch is historical evidence only; this recovery uses a new exact pre-dispatch intent and remains NON_COUNTING.","sha256":null}
  ],
  "allowed_actions": [
    "READ_FROZEN_REPOSITORY_CONTRACTS",
    "VERIFY_ALL_NON_NULL_INPUT_HASHES",
    "VERIFY_GIT_OBJECT_LINEAGE",
    "VERIFY_ORIGINAL_TASK_DISPATCH_RESULT_CLOSURE",
    "VERIFY_MANAGER_VALIDATION_RECEIPT",
    "RUN_PYTHON_COMPILE_CHECK",
    "RUN_EXACT_127_OFFLINE_TESTS",
    "AUDIT_FROZEN_ECONOMIC_GATE_SEMANTICS",
    "AUDIT_FIXED_ROOT_AND_CREATE_ONCE_SAFETY",
    "VALIDATE_LOCAL_TASK_DISPATCH_AND_RESULT",
    "RUN_GIT_DIFF_CHECK",
    "RETURN_LOCAL_RESEARCH_RESULT"
  ],
  "forbidden_actions": [
    "CANONICAL_STATE_WRITE",
    "SERVER_RESEARCH_MCP_WRITE",
    "SECOND_TIMER_OR_WRITER",
    "TRADING_DB_ORDERS_FUNDS_SHADOW_PAPER_LIVE",
    "OOS_OPEN_OR_GATE_RELAXATION",
    "EXTERNAL_BACKFILL_OR_IMPORT",
    "PAID_API_OR_API_KEY",
    "PRODUCTION_OR_DATABASE_MUTATION",
    "FUTURE_EVIDENCE_OR_OUTCOME_ACCESS",
    "REAL_FIXED_ROOT_RUNNER_EXECUTION",
    "LOCAL_INBOX_OR_OUTBOX_ACCESS",
    "SERVER_NETWORK_OR_SSH_ACCESS",
    "CLOUD_SCHEDULE_CREATE_UPDATE_OR_DELETE",
    "ORIGINAL_TASK_DISPATCH_INTENT_RESULT_EDIT",
    "IMPLEMENTATION_CONTRACT_SCHEMA_OR_TEST_EDIT",
    "HYPOTHESIS_MANIFEST_CANDIDATE_OR_EXPERIMENT_REGISTRATION",
    "V4_SOURCE_MANIFEST_ADAPTER_OR_RUNNER_IMPLEMENTATION",
    "HISTORICAL_PERFORMANCE_RECOMPUTATION",
    "RESEARCH_STATE_WRITE_OR_UNLISTED_ARTIFACT_ACCESS",
    "GIT_STAGE_COMMIT_PUSH_RESET_CLEAN_OR_BRANCH_CHANGE",
    "FILE_EDIT_OR_ARTIFACT_WRITE"
  ],
  "expected_outputs": [
    "EXACT_GIT_LINEAGE_PROOF",
    "CURRENT_ARTIFACT_HASH_CLOSURE",
    "ORIGINAL_LIFECYCLE_FAIL_CLOSED_AUDIT",
    "MANAGER_VALIDATION_RECEIPT_AUDIT",
    "EXACT_127_TEST_RESULT",
    "FROZEN_ECONOMIC_GATE_SEMANTIC_AUDIT",
    "FIXED_ROOT_AND_CREATE_ONCE_SAFETY_AUDIT",
    "NON_COUNTING_ACCEPTANCE_DISPOSITION",
    "ZERO_IMMEDIATE_PERFORMANCE_EFFECT",
    "MISSING_PROOF_BOUNDARY",
    "RECOMMENDED_NEXT_ACTION"
  ],
  "stop_conditions": [
    "Validate this exact task, its Manager dispatch and pre-dispatch intent, clean branch, HEAD equal local origin and every non-null input SHA-256 before analysis. Any mismatch is an integrity stop with zero file changes.",
    "Use only listed repository bytes and Git objects. Do not read real Local inbox/outbox roots, R2 evidence, outcomes, canonical state, server, network, .research-state, OOS or Trading surfaces.",
    "Verify implementation commit b400d49b73018376c71a8bc923f42ff23f503566 has sole parent 8ffc8ac57a79037cef1adbb9afa8f652538221db and added exactly the four implementation paths plus the original Local result. Current implementation bytes must equal both that commit and the Manager receipt hashes.",
    "Validate the original task, dispatch and BLOCKED result closure without editing them. Record the old claim digest mismatch and withdrawn acceptance as historical lifecycle evidence; do not reinterpret or repair the old intent.",
    "Verify the exact Manager receipt hash and all receipt identities, artifact hashes, test count, Draft 2020-12 positive/negative checks, payload seal and all-false safety boundary. Contradiction or unverifiable receipt content prevents positive recovery.",
    "Compile the evaluator, runner and focused test module, then run exactly the ten listed unittest modules totaling 127 tests. A failure, skipped substitution, test edit or count drift rejects acceptance; unavailable execution remains MISSING_PROOF.",
    "Audit that the evaluator still enforces selected-tier-only m+2 entry, m+62 exit, 60-minute holding/cooldown, exit-before-entry, 30 USDT long-only candidate/control ledgers, exact Decimal costs, earlier-day matched controls, two seven-day halves, drawdown, breadth and concentration gates.",
    "Audit that the zero-argument runner still binds only frozen fixed roots, rejects caller paths and linked/reparse/conflicting outputs, snapshots source bytes, validates all fourteen day bundles plus positive interpretation and publishes exactly one create-once result. Never execute those roots.",
    "Return MICROSTRUCTURE_ECONOMIC_VETO_RUNNER_ACCEPTANCE_RECOVERED only when all lineage, receipt, compile, exact 127-test, semantic and safety checks pass on unchanged bytes. Return MICROSTRUCTURE_ECONOMIC_VETO_RUNNER_ACCEPTANCE_REJECTED on contradiction or MICROSTRUCTURE_ECONOMIC_VETO_RUNNER_ACCEPTANCE_MISSING_PROOF when a mandatory check is unavailable.",
    "This recovery is NON_COUNTING within the existing OKX microstructure economic-veto capability family. It creates no new mechanism conclusion, independent capability family, strategy, hypothesis, candidate, V4 route, OOS result or activation claim.",
    "Immediate fee-adjusted PnL and drawdown effects are zero. Real R2 economics, false-negative risk, predictive value, capacity, V4 readiness, candidate value, OOS and Trading value remain MISSING_PROOF.",
    "Make no file changes. Return exactly one schema-valid Local result bound to this task SHA with empty files_changed and artifacts, clean before/after, all safety assertions false and one bounded next action."
  ],
  "limits": {
    "timeout_seconds": 1800,
    "max_files_changed": 0,
    "max_candidate_variants": 0,
    "network_access": "NONE"
  }
}
