{
  "schema_version": "1",
  "task_id": "local-node-research-worker-active-source-readonly-verification-v1",
  "issued_at": "2026-08-09T10:19:04Z",
  "manager_thread_id": "019fca63-4f8f-71e3-9d88-297bca468eb9",
  "task_type": "TOOLING_VERTICAL_SLICE",
  "execution_mode": "WORKTREE_WRITE",
  "objective": "Repair the standalone Research Worker SSH verifier wrapper after the dual-release-lane cutover so a Manager can explicitly attest the expected control release, data release and active-or-disabled microstructure source state without an interactive prompt or inferred server expectation. Change exactly the wrapper, its focused release-lane test and the deployment runbook. Preserve the existing verifier bytes and every default no-heartbeat, no-source-probe, no-deployment and single-clock boundary. Stop at source readiness for independent Manager validation; do not connect to a server, run the verifier remotely, trigger a heartbeat, probe a source, deploy, install or touch canonical or Trading state.",
  "canonical_research_status": "WAITING_FOR_EVIDENCE;GENERAL_FORWARD_3_OF_90;MICROSTRUCTURE_R1_0_OF_14_CURRENT_UTC_DAY;SOURCE_EXPECTED_ACTIVE",
  "authorization": "RESEARCH_ONLY_NOT_SHADOW_PAPER_OR_LIVE",
  "state_authority": "SERVER_CANONICAL",
  "timer_authority": "CODEX_CLOUD_OPS_ONLY",
  "inputs": [
    {"kind":"REPOSITORY_PATH","locator":"AGENTS.md","sha256":"acae1925d4f2247dc8ffbd60efd7d9bd86844ef6ce9bf8f3b5bdf57906177e50"},
    {"kind":"REPOSITORY_PATH","locator":"docs/autonomous-research-charter.md","sha256":"2465198fea55728cd087d244827b37bf6196723334f05c54db8f076b84bd5334"},
    {"kind":"REPOSITORY_PATH","locator":"docs/local-codex-research-node-v1.md","sha256":"74f68c16995f292759f9c11b4a8c33dad9de5e010c50da5699a751802f13f024"},
    {"kind":"REPOSITORY_PATH","locator":"docs/server-research-worker-v2.md","sha256":"e91d1a3f74e7a546165c0a98369ef995bd22583f9a6da6b14feaabf0968b5111"},
    {"kind":"REPOSITORY_PATH","locator":"docs/deploy-runbook.md","sha256":"8f2166aa742bac6fe8891e7bc2099aa859850cf6a902597ed98d13b59e80703b"},
    {"kind":"REPOSITORY_PATH","locator":".agents/skills/autonomous-trading-research/SKILL.md","sha256":"7627a7b10d3a4d70ec6e1453a6c1f75fcf22249faaa6283855bc24dd82e6be65"},
    {"kind":"REPOSITORY_PATH","locator":"research_pipeline/policy.v3.json","sha256":"a82ccff13c13765d1e94a29698a43b35b847ed19190965590fa72e9a102981f6"},
    {"kind":"REPOSITORY_PATH","locator":"research_pipeline/local-research-task.schema.json","sha256":"bcb72265dfffcea0ba52a7c200d1c499b2cab112251049f4f5e7f8acc4ab79cf"},
    {"kind":"REPOSITORY_PATH","locator":"research_pipeline/local-research-result.schema.json","sha256":"baeb8d3c61dd685234ac24d1f5211199af47398702f076a347f7a4e807f97659"},
    {"kind":"REPOSITORY_PATH","locator":"research_pipeline/local-research-dispatch.schema.json","sha256":"05e83891222afba5c526afc1de668c0f24e6e3872a224627dd773d665bf1e435"},
    {"kind":"REPOSITORY_PATH","locator":"scripts/verify_research_worker_ssh.ps1","sha256":"2a677238906e6df3aa652e73c3a1a2d6451b0dfd476f8552bfdfd3a8855ce410"},
    {"kind":"REPOSITORY_PATH","locator":"scripts/research-worker/verify-worker.sh","sha256":"fca4f797b52e0b4a8f57be3c6de2778eccff45336ab255deeeba1eb8e50cc33f"},
    {"kind":"REPOSITORY_PATH","locator":"research_pipeline/tests/test_research_worker_release_lanes.py","sha256":"70e4b56a8ffd25d6df86b4e63d053b854d846f460788eca76d5a2ff99fc30a0f"},
    {"kind":"TASK_MESSAGE","locator":"Static defect: verify-worker.sh now requires EXPECTED_CONTROL_RELEASE_ID and EXPECTED_DATA_RELEASE_ID and supports active source verification only with EXPECT_MICROSTRUCTURE_SOURCE=active plus MICROSTRUCTURE_INTAKE_PREFLIGHT=1, while scripts/verify_research_worker_ssh.ps1 passes none of those values and defaults the remote verifier to disabled-source semantics. Do not infer expected release ids from remote symlinks because that would weaken independent attestation.","sha256":null},
    {"kind":"CANONICAL_STATUS","locator":"2026-08-09T10:16:31Z Server Canonical: policy, Worker release 20260808T052741Z and sole CLOUD_OPS_SCHEDULE_V7 READY; all queues IDLE; general forward evidence 3/90 with lag 0; microstructure R1 0/14 WAITING_FOR_DAY and CURRENT_UTC_DAY; no candidate and no due heartbeat before 2026-08-10T01:00:00Z.","sha256":null}
  ],
  "allowed_actions": [
    "READ_EXACT_FROZEN_INPUTS",
    "VERIFY_TASK_DISPATCH_AND_INPUT_HASHES",
    "MODIFY_EXACT_THREE_STANDALONE_VERIFICATION_PATHS",
    "ADD_EXPLICIT_DUAL_RELEASE_EXPECTATIONS",
    "ADD_EXPLICIT_MICROSTRUCTURE_SOURCE_EXPECTATION",
    "DERIVE_ACTIVE_INTAKE_PREFLIGHT_FLAG",
    "PRESERVE_DEFAULT_NO_HEARTBEAT_AND_NO_SOURCE_PROBE",
    "ADD_FOCUSED_STATIC_RELEASE_LANE_TESTS",
    "UPDATE_READONLY_VERIFICATION_DOCUMENTATION",
    "RUN_POWERSHELL_AST_SYNTAX_CHECK",
    "RUN_AVAILABLE_FOCUSED_OFFLINE_TESTS",
    "RUN_STATIC_SOURCE_AND_DIFF_CHECKS",
    "RETURN_SCHEMA_VALID_RESULT"
  ],
  "forbidden_actions": [
    "CANONICAL_STATE_WRITE",
    "SERVER_RESEARCH_MCP_WRITE",
    "SECOND_TIMER_OR_WRITER",
    "TRADING_DB_ORDERS_FUNDS_SHADOW_PAPER_LIVE",
    "OOS_OPEN_OR_GATE_RELAXATION",
    "EXTERNAL_BACKFILL_OR_IMPORT",
    "PAID_API_OR_API_KEY",
    "PRODUCTION_OR_DATABASE_MUTATION",
    "SERVER_NETWORK_OR_SSH_EXECUTION",
    "CLOUD_SCHEDULE_CREATE_UPDATE_DELETE_OR_HEARTBEAT",
    "RESEARCH_STATE_QUEUE_BINDING_REQUEST_OR_REGISTRATION_WRITE",
    "SYSTEMD_INSTALL_DAEMON_RELOAD_ENABLE_START_STOP_OR_RESTART",
    "REMOTE_RELEASE_DISCOVERY_OR_EXPECTATION_INFERENCE",
    "RUN_HEARTBEAT_OR_SOURCE_PROBE",
    "VERIFY_WORKER_SHELL_OR_SCIENTIFIC_CONTRACT_EDIT",
    "GIT_STAGE_COMMIT_PUSH_RESET_OR_BRANCH_CHANGE",
    "OTHER_FILE_EDIT_OR_IGNORED_OUTPUT"
  ],
  "expected_outputs": [
    "EXACT_THREE_FILE_CHANGESET",
    "NONINTERACTIVE_DUAL_RELEASE_ATTESTATION_PARAMETERS",
    "EXPLICIT_ACTIVE_OR_DISABLED_SOURCE_EXPECTATION",
    "ACTIVE_SOURCE_REQUIRES_INTAKE_PREFLIGHT",
    "DEFAULT_HEARTBEAT_AND_SOURCE_PROBE_REMAIN_OFF",
    "FOCUSED_STATIC_TEST_EVIDENCE",
    "POWERSHELL_SYNTAX_PASS",
    "MISSING_PROOF_REGISTER",
    "RECOMMENDED_NEXT_ACTION"
  ],
  "stop_conditions": [
    "Before editing, validate this exact task and Manager dispatch and re-hash every non-null input. Require clean branch HEAD equal to origin and reject links, duplicate locators, drift or pre-existing changes outside the three targets.",
    "Change exactly scripts/verify_research_worker_ssh.ps1, research_pipeline/tests/test_research_worker_release_lanes.py and docs/deploy-runbook.md. Create no generated, ignored or fourth path.",
    "Add noninteractive ExpectedControlReleaseId and ExpectedDataReleaseId inputs with optional dedicated environment defaults and explicit fail-fast validation. Do not use mandatory PowerShell prompting and do not print an SSH key or secret.",
    "Add one explicit ExpectMicrostructureSource value restricted to disabled or active. An absent, blank or unsupported value must fail before SSH rather than silently assume the currently deployed source state.",
    "Keep release ids restricted to the verifier's existing safe A-Za-z0-9._- alphabet and pass the exact expected control and data ids into the streamed remote verifier without caller-selected command or path construction.",
    "When and only when ExpectMicrostructureSource is active, pass MICROSTRUCTURE_INTAKE_PREFLIGHT=1; pass 0 for disabled. Preserve EXPECT_TIMER and the existing fixed verifier body transport.",
    "Do not discover, readlink or infer an expected release or source state from the remote host inside the wrapper. The Manager must provide independently observed expectations so the verifier can detect unexpected lane drift.",
    "Preserve RunHeartbeat and RunSourceProbe only as explicit opt-in switches and keep both false by default. This task must not invoke either switch, SSH, public network, systemd or any server operation.",
    "Focused tests must bind the standalone wrapper and prove both release expectations are required noninteractively, the safe release-id validation, exact remote environment binding, active-to-preflight derivation, explicit source-state requirement and unchanged default no-run flags.",
    "Update the runbook with separate disabled-source and active-source read-only examples, explain that release ids are independent expectations rather than remote discovery, and state that the commands do not prove predictive value, PnL or drawdown.",
    "Run exact task and dispatch validation, PowerShell AST parsing, the focused release-lane test when Python is available, exact three-path scope and git diff --check. If Local Python is unavailable, preserve that as MISSING_PROOF and leave full executable acceptance to Manager without requesting permission.",
    "Status COMPLETED means only ACTIVE_SOURCE_READONLY_VERIFIER_SOURCE_READY_FOR_MANAGER_VALIDATION. Return exactly three files_changed with hashes, source_git_dirty_after=true, all safety assertions false, concrete static evidence and every unrun test as MISSING_PROOF.",
    "Stop fail closed on a need for a fourth file, verifier-shell change, server discovery, SSH execution, deployment, heartbeat, source probe, canonical write, schedule change, evidence access, Trading action or weakened attestation. Do not request permission."
  ],
  "limits": {
    "timeout_seconds": 1800,
    "max_files_changed": 3,
    "max_candidate_variants": 0,
    "network_access": "NONE"
  }
}
